{"schema_version":1,"id":"mail_01JYX","recipient":{"peer_id":"peer_hero","registry_slug":"hero","display_name":"Hero"},"sender":{"peer_id":"peer_cloud","display_name":"Hero Cloud"},"subject":"Review the inbox contract","body":"The durable attention contract is ready for review.","created_at":"2026-07-22T18:00:00.123456789Z","provenance":[{"kind":"peer_call","source_id":"call_01JYX","label":"Design discussion","created_at":"2026-07-22T17:59:00Z"}]}
